disarm_id;name;name_DE;tactic_id;summary;summary_DE;changes from v0.1;longname;;;;;;;;;;;;;;;;;;
T0002;Facilitate State Propaganda;;TA02;Organise citizens around pro-state messaging. Coordinate paid or volunteer groups to push state propaganda.;;no change;T0002 - Facilitate State Propaganda;;;;;;;;;;;;;;;;;;
T0003;Leverage Existing Narratives;;TA14;Use or adapt existing narrative themes, where narratives are the baseline stories of a target audience. Narratives form the bedrock of our worldviews. New information is understood through a process firmly grounded in this bedrock. If new information is not consitent with the prevailing narratives of an audience, it will be ignored. Effective campaigns will frame their misinformation in the context of these narratives. Highly effective campaigns will make extensive use of audience-appropriate archetypes and meta-narratives throughout their content creation and amplifiction practices.;;no change;T0003 - Leverage Existing Narratives;;;;;;;;;;;;;;;;;;
T0004;Develop Competing Narratives;;TA14;"Advance competing narratives connected to same issue ie: on one hand deny incident while at same time expresses dismiss. Suppressing or discouraging narratives already spreading requires an alternative. The most simple set of narrative techniques in response would be the construction and promotion of contradictory alternatives centred on denial, deflection, dismissal, counter-charges, excessive standards of proof, bias in prohibition or enforcement, and so on. These competing narratives allow loyalists cover, but are less compelling to opponents and fence-sitters than campaigns built around existing narratives or highly explanatory master narratives. Competing narratives, as such, are especially useful in the ""firehose of misinformation"" approach.";;no change;T0004 - Develop Competing Narratives;;;;;;;;;;;;;;;;;;
T0010;Cultivate Ignorant Agents;;TA15;"Cultivate propagandists for a cause, the goals of which are not fully comprehended, and who are used cynically by the leaders of the cause. Independent actors use social media and specialised web sites to strategically reinforce and spread messages compatible with their own. Their networks are infiltrated and used by state media disinformation organisations to amplify the state’s own disinformation strategies against target populations. Many are traffickers in conspiracy theories or hoaxes, unified by a suspicion of Western governments and mainstream media. Their narratives, which appeal to leftists hostile to globalism and military intervention and nationalists against immigration, are frequently infiltrated and shaped by state-controlled trolls and altered news items from agencies such as RT and Sputnik. Also know as ""useful idiots"" or ""unwitting agents"".";;no change;T0010 - Cultivate Ignorant Agents;;;;;;;;;;;;;;;;;;
T0014;Prepare Fundraising Campaigns;;TA15;Fundraising campaigns refer to an influence operation’s systematic effort to seek financial support for a charity, cause, or other enterprise using online activities that further promote operation information pathways while raising a profit. Many influence operations have engaged in crowdfunding services on platforms including Tipee, Patreon, and GoFundMe. An operation may use its previously prepared fundraising campaigns (see: Develop Information Pathways) to promote operation messaging while raising money to support its activities.;;no change;T0014 - Prepare Fundraising Campaigns;;;;;;;;;;;;;;;;;;
T0014.001;Raise Funds from Malign Actors;;TA15;Raising funds from malign actors may include contributions from foreign agents, cutouts or proxies, shell companies, dark money groups, etc.;;no change;Raise Funds from Malign Actors -;;;;;;;;;;;;;;;;;;
T0014.002;Raise Funds from Ignorant Agents;;TA15;Raising funds from ignorant agents may include scams, donations intended for one stated purpose but then used for another, etc.;;no change;Raise Funds from Ignorant Agents -;;;;;;;;;;;;;;;;;;
T0015;Create Hashtags and Search Artefacts;;TA06;"Create one or more hashtags and/or hashtag groups. Many incident-based campaigns will create hashtags to promote their fabricated event. Creating a hashtag for an incident can have two important effects: 1. Create a perception of reality around an event. Certainly only ""real"" events would be discussed in a hashtag. After all, the event has a name!, and 2. Publicise the story more widely through trending lists and search behaviour. Asset needed to direct/control/manage ""conversation"" connected to launching new incident/campaign with new hashtag for applicable social media sites).";;no change;T0015 - Create Hashtags and Search Artefacts;;;;;;;;;;;;;;;;;;
T0015.001;Use Existing Hashtag;;TA06;Use a dedicated, existing hashtag for the campaign/incident. This Technique covers behaviours previously documented by T0104.005: Use Hashtags, which has since been deprecated.  ;;moved in V1.6;Use Existing Hashtag -;;;;;;;;;;;;;;;;;;
T0015.002;Create New Hashtag;;TA06;Create a campaign/incident specific hashtag. This Technique covers behaviours previously documented by T0104.006: Create Dedicated Hashtag, which has since been deprecated. ;;moved in V1.6;Create New Hashtag -;;;;;;;;;;;;;;;;;;
T0016;Create Clickbait;;TA05;Create attention grabbing headlines (outrage, doubt, humour) required to drive traffic & engagement. This is a key asset.;;no change;T0016 - Create Clickbait;;;;;;;;;;;;;;;;;;
T0017;Conduct Fundraising;;TA10;Fundraising campaigns refer to an influence operation’s systematic effort to seek financial support for a charity, cause, or other enterprise using online activities that further promote operation information pathways while raising a profit. Many influence operations have engaged in crowdfunding services166 on platforms including Tipee, Patreon, and GoFundMe. An operation may use its previously prepared fundraising campaigns to promote operation messaging while raising money to support its activities.;;no change;T0017 - Conduct Fundraising;;;;;;;;;;;;;;;;;;
T0017.001;Conduct Crowdfunding Campaigns;;TA10;An influence operation may Conduct Crowdfunding Campaigns on platforms such as GoFundMe, GiveSendGo, Tipeee, Patreon, etc.;;no change;Conduct Crowdfunding Campaigns -;;;;;;;;;;;;;;;;;;
T0018;Purchase Targeted Advertisements;;TA05;Create or fund advertisements targeted at specific populations;;no change;T0018 - Purchase Targeted Advertisements;;;;;;;;;;;;;;;;;;
T0020;Trial Content;;TA08;"Iteratively test incident performance (messages, content etc), e.g. A/B test headline/content enagagement metrics; website and/or funding campaign conversion rates";;no change;T0020 - Trial Content;;;;;;;;;;;;;;;;;;
T0022;Leverage Conspiracy Theory Narratives;;TA14;"""Conspiracy narratives"" appeal to the human desire for explanatory order, by invoking the participation of poweful (often sinister) actors in pursuit of their own political goals. These narratives are especially appealing when an audience is low-information, marginalised or otherwise inclined to reject the prevailing explanation. Conspiracy narratives are an important component of the ""firehose of falsehoods"" model.";;no change;T0022 - Leverage Conspiracy Theory Narratives;;;;;;;;;;;;;;;;;;
T0022.001;Amplify Existing Conspiracy Theory Narratives;;TA14;An influence operation may amplify an existing conspiracy theory narrative that aligns with its incident or campaign goals. By amplifying existing conspiracy theory narratives, operators can leverage the power of the existing communities that support and propagate those theories without needing to expend resources creating new narratives or building momentum and buy in around new narratives.;;no change;Amplify Existing Conspiracy Theory Narratives -;;;;;;;;;;;;;;;;;;
T0022.002;Develop Original Conspiracy Theory Narratives;;TA14;While this requires more resources than amplifying existing conspiracy theory narratives, an influence operation may develop original conspiracy theory narratives in order to achieve greater control and alignment over the narrative and their campaign goals. Prominent examples include the USSR's Operation INFEKTION disinformation campaign run by the KGB in the 1980s to plant the idea that the United States had invented HIV/AIDS as part of a biological weapons research project at Fort Detrick, Maryland. More recently, Fort Detrick featured prominently in a new conspiracy theory narratives around the origins of the COVID-19 outbreak and pandemic.;;no change;Develop Original Conspiracy Theory Narratives -;;;;;;;;;;;;;;;;;;
T0023;Distort Facts;;TA06;Change, twist, or exaggerate existing facts to construct a narrative that differs from reality. Examples: images and ideas can be distorted by being placed in an improper content;;no change;T0023 - Distort Facts;;;;;;;;;;;;;;;;;;
T0023.001;Reframe Context;;TA06;Reframing context refers to removing an event from its surrounding context to distort its intended meaning. Rather than deny that an event occurred, reframing context frames an event in a manner that may lead the target audience to draw a different conclusion about its intentions.;;no change;Reframe Context -;;;;;;;;;;;;;;;;;;
T0023.002;Edit Open-Source Content;;TA06;An influence operation may edit open-source content, such as collaborative blogs or encyclopaedias, to promote its narratives on outlets with existing credibility and audiences. Editing open-source content may allow an operation to post content on platforms without dedicating resources to the creation and maintenance of its own assets.;;no change;Edit Open-Source Content -;;;;;;;;;;;;;;;;;;
T0029;Online Polls;;TA07;Create fake online polls, or manipulate existing online polls. Data gathering tactic to target those who engage, and potentially their networks of friends/followers as well;;no change;T0029 - Online Polls;;;;;;;;;;;;;;;;;;
T0039;Bait Influencer;;TA17;Influencers are people on social media platforms who have large audiences.<br /> <br />Threat Actors can try to trick Influencers such as celebrities, journalists, or local leaders who aren’t associated with their campaign into amplifying campaign content. This gives them access to the Influencer’s audience without having to go through the effort of building it themselves, and it helps legitimise their message by associating it with the Influencer, benefitting from their audience’s trust in them.;;New Summary, Tactic, V1.4;T0039 - Bait Influencer;;;;;;;;;;;;;;;;;;
T0040;Demand Insurmountable Proof;;TA14;"Campaigns often leverage tactical and informational asymmetries on the threat surface, as seen in the Distort and Deny strategies, and the ""firehose of misinformation"". Specifically, conspiracy theorists can be repeatedly wrong, but advocates of the truth need to be perfect. By constantly escalating demands for proof, propagandists can effectively leverage this asymmetry while also priming its future use, often with an even greater asymmetric advantage. The conspiracist is offered freer rein for a broader range of ""questions"" while the truth teller is burdened with higher and higher standards of proof.";;no change;T0040 - Demand Insurmountable Proof;;;;;;;;;;;;;;;;;;
T0042;Seed Kernel of Truth;;TA08;"Wrap lies or altered context/facts around truths. Influence campaigns pursue a variety of objectives with respect to target audiences, prominent among them: 1. undermine a narrative commonly referenced in the target audience; or 2. promote a narrative less common in the target audience, but preferred by the attacker. In both cases, the attacker is presented with a heavy lift. They must change the relative importance of various narratives in the interpretation of events, despite contrary tendencies. When messaging makes use of factual reporting to promote these adjustments in the narrative space, they are less likely to be dismissed out of hand; when messaging can juxtapose a (factual) truth about current affairs with the (abstract) truth explicated in these narratives, propagandists can undermine or promote them selectively. Context matters.";;no change;T0042 - Seed Kernel of Truth;;;;;;;;;;;;;;;;;;
T0044;Seed Distortions;;TA08;Try a wide variety of messages in the early hours surrounding an incident or event, to give a misleading account or impression.;;no change;T0044 - Seed Distortions;;;;;;;;;;;;;;;;;;
T0045;Use Fake Experts;;TA08;"Use the fake experts that were set up during Establish Legitimacy. Pseudo-experts are disposable assets that often appear once and then disappear. Give ""credility"" to misinformation. Take advantage of credential bias";;no change;T0045 - Use Fake Experts;;;;;;;;;;;;;;;;;;
T0046;Use Search Engine Optimisation;;TA08;"Manipulate content engagement metrics (ie: Reddit & Twitter) to influence/impact news search results (e.g. Google), also elevates RT & Sputnik headline into Google news alert emails. aka ""Black-hat SEO""";;no change;T0046 - Use Search Engine Optimisation;;;;;;;;;;;;;;;;;;
T0047;Censor Social Media as a Political Force;;TA18;Use political influence or the power of state to stop critical social media comments. Government requested/driven content take downs (see Google Transperancy reports).;;no change;T0047 - Censor Social Media as a Political Force;;;;;;;;;;;;;;;;;;
T0048;Harass;;TA18;Threatening or harassing believers of opposing narratives refers to the use of intimidation techniques, including cyberbullying and doxing, to discourage opponents from voicing their dissent. An influence operation may threaten or harass believers of the opposing narratives to deter individuals from posting or proliferating conflicting content.;;no change;T0048 - Harass;;;;;;;;;;;;;;;;;;
T0048.001;"Boycott/""Cancel"" Opponents";;TA18;Cancel culture refers to the phenomenon in which individuals collectively refrain from supporting an individual, organisation, business, or other entity, usually following a real or falsified controversy. An influence operation may exploit cancel culture by emphasising an adversary’s problematic or disputed behaviour and presenting its own content as an alternative.;;no change;"Boycott/""Cancel"" Opponents -";;;;;;;;;;;;;;;;;;
T0048.002;Harass People Based on Identities;;TA18;Examples include social identities like gender, sexuality, race, ethnicity, religion, ability, nationality, etc. as well as roles and occupations like journalist or activist.;;no change;Harass People Based on Identities -;;;;;;;;;;;;;;;;;;
T0048.003;Threaten to Dox;;TA18;Doxing refers to online harassment in which individuals publicly release private information about another individual, including names, addresses, employment information, pictures, family members, and other sensitive information. An influence operation may dox its opposition to encourage individuals aligned with operation narratives to harass the doxed individuals themselves or otherwise discourage the doxed individuals from posting or proliferating conflicting content.;;no change;Threaten to Dox -;;;;;;;;;;;;;;;;;;
T0048.004;Dox;;TA18;Doxing refers to online harassment in which individuals publicly release private information about another individual, including names, addresses, employment information, pictures, family members, and other sensitive information. An influence operation may dox its opposition to encourage individuals aligned with operation narratives to harass the doxed individuals themselves or otherwise discourage the doxed individuals from posting or proliferating conflicting content.;;no change;Dox -;;;;;;;;;;;;;;;;;;
T0049;Flood Information Space;;TA17;Flooding sources of information (e.g. Social Media feeds) with a high volume of inauthentic content.<br /> <br />This can be done to control/shape online conversations, drown out opposing points of view, or make it harder to find legitimate information.<br /> <br />Bots and/or patriotic trolls are effective tools to achieve this effect.<br /> <br />This Technique previously used the name Flooding the Information Space.;;Updated V1.4;T0049 - Flood Information Space;;;;;;;;;;;;;;;;;;
T0049.001;Trolls Amplify and Manipulate;;TA17;Use trolls to amplify narratives and/or manipulate narratives. Fake profiles/sockpuppets operating to support individuals/narratives from the entire political spectrum (left/right binary). Operating with increased emphasis on promoting local content and promoting real Twitter users generating their own, often divisive political content, as it's easier to amplify existing content than create new/original content. Trolls operate where ever there's a socially divisive issue (issues that can/are be politicized).;;no change;Trolls Amplify and Manipulate -;;;;;;;;;;;;;;;;;;
T0049.002;Flood Existing Hashtag;;TA17;Hashtags can be used by communities to collate information they post about particular topics (such as their interests, or current events) and users can find communities to join by exploring hashtags they’re interested in.<br /> <br />Threat actors can flood an existing hashtag to try to ruin hashtag functionality, posting content unrelated to the hashtag alongside it, making it a less reliable source of relevant information. They may also try to flood existing hashtags with campaign content, with the intent of maximising exposure to users.<br /> <br />This Technique covers cases where threat actors flood existing hashtags with campaign content.<br /> <br />This Technique covers behaviours previously documented by T0019.002: Hijack Hashtags, which has since been deprecated. This Technique was previously called Hijack Existing Hashtag.;;Updated V1.4;Hijack Existing Hashtag -;;;;;;;;;;;;;;;;;;
T0049.003;Bots Amplify via Automated Forwarding and Reposting;;TA17;"Automated forwarding and reposting refer to the proliferation of operation content using automated means, such as artificial intelligence or social media bots. An influence operation may use automated activity to increase content exposure without dedicating the resources, including personnel and time, traditionally required to forward and repost content. Use bots to amplify narratives above algorithm thresholds. Bots are automated/programmed profiles designed to amplify content (ie: automatically retweet or like) and give appearance it's more ""popular"" than it is. They can operate as a network, to function in a coordinated/orchestrated manner. In some cases (more so now) they are an inexpensive/disposable assets used for minimal deployment as bot detection tools improve and platforms are more responsive.";;no change;Bots Amplify via Automated Forwarding and Reposting -;;;;;;;;;;;;;;;;;;
T0049.004;Utilise Spamoflauge;;TA17;"Spamoflauge refers to the practice of disguising spam messages as legitimate. Spam refers to the use of electronic messaging systems to send out unrequested or unwanted messages in bulk. Simple methods of spamoflauge include replacing letters with numbers to fool keyword-based email spam filters, for example, ""you've w0n our jackp0t!"". Spamoflauge may extend to more complex techniques such as modifying the grammar or word choice of the language, casting messages as images which spam detectors cannot automatically read, or encapsulating messages in password protected attachments, such as .pdf or .zip files. Influence operations may use spamoflauge to avoid spam filtering systems and increase the likelihood of the target audience receiving operation messaging.";;no change;Utilise Spamoflauge -;;;;;;;;;;;;;;;;;;
T0049.005;Conduct Swarming;;TA17;Swarming refers to the coordinated use of accounts to overwhelm the information space with operation content. Unlike information flooding, swarming centres exclusively around a specific event or actor rather than a general narrative. Swarming relies on “horizontal communication” between information assets rather than a top-down, vertical command-and-control approach.;;no change;Conduct Swarming -;;;;;;;;;;;;;;;;;;
T0049.006;Conduct Keyword Squatting;;TA17;Keyword squatting refers to the creation of online content, such as websites, articles, or social media accounts, around a specific search engine-optimized term to overwhelm the search results of that term. An influence may keyword squat to increase content exposure to target audience members who query the exploited term in a search engine and manipulate the narrative around the term.;;no change;Conduct Keyword Squatting -;;;;;;;;;;;;;;;;;;
T0049.007;Inauthentic Sites Amplify News and Narratives;;TA17;Inauthentic sites circulate cross-post stories and amplify narratives. Often these sites have no masthead, bylines or attribution.;;no change;Inauthentic Sites Amplify News and Narratives -;;;;;;;;;;;;;;;;;;
T0049.008;Generate Information Pollution;;TA17;Information Pollution occurs when threat actors attempt to ruin a source of information by flooding it with lots of inauthentic or unreliable content, intending to make it harder for legitimate users to find the information they’re looking for.<br /> <br />This sub-technique’s objective is to reduce exposure to target information, rather than promoting exposure to campaign content, for which the parent Technique T0049 can be used.<br /> <br />Analysts will need to infer what the motive for flooding an information space was when deciding whether to use T0049 or T0049.008 to tag a case when an information space is flooded. If such inference is not possible, default to T0049.<br /> <br />This Technique previously used the ID T0019.;;Added V1.4;;;;;;;;;;;;;;;;;;;
T0057;Organise Events;;TA10;Coordinate and promote real-world events across media platforms, e.g. rallies, protests, gatherings in support of incident narratives.;;no change;T0057 - Organise Events;;;;;;;;;;;;;;;;;;
T0057.001;Pay for Physical Action;;TA10;Paying for physical action occurs when an influence operation pays individuals to act in the physical realm. An influence operation may pay for physical action to create specific situations and frame them in a way that supports operation narratives, for example, paying a group of people to burn a car to later post an image of the burning car and frame it as an act of protest.;;no change;Pay for Physical Action -;;;;;;;;;;;;;;;;;;
T0057.002;Conduct Symbolic Action;;TA10;Symbolic action refers to activities specifically intended to advance an operation’s narrative by signalling something to the audience, for example, a military parade supporting a state’s narrative of military superiority. An influence operation may use symbolic action to create falsified evidence supporting operation narratives in the physical information space.;;no change;Conduct Symbolic Action -;;;;;;;;;;;;;;;;;;
T0059;Play the Long Game;;TA11;Play the long game refers to two phenomena: 1. To plan messaging and allow it to grow organically without conducting your own amplification. This is methodical and slow and requires years for the message to take hold 2. To develop a series of seemingly disconnected messaging narratives that eventually combine into a new narrative.;;no change;T0059 - Play the Long Game;;;;;;;;;;;;;;;;;;
T0060;Continue to Amplify;;TA11;continue narrative or message amplification after the main incident work has finished;;no change;T0060 - Continue to Amplify;;;;;;;;;;;;;;;;;;
T0061;Sell Merchandise;;TA10;Sell mechandise refers to getting the message or narrative into physical space in the offline world while making money;;no change;T0061 - Sell Merchandise;;;;;;;;;;;;;;;;;;
T0065;Prepare Physical Broadcast Capabilities;;TA15;Create or coopt broadcast capabilities (e.g. TV, radio etc).;;no change;T0065 - Prepare Physical Broadcast Capabilities;;;;;;;;;;;;;;;;;;
T0066;Degrade Adversary;;TA02;Plan to degrade an adversary’s image or ability to act. This could include preparation and use of harmful information about the adversary’s actions or reputation.;;no change;T0066 - Degrade Adversary;;;;;;;;;;;;;;;;;;
T0068;Respond to Breaking News Event or Active Crisis;;TA14;Media attention on a story or event is heightened during a breaking news event, where unclear facts and incomplete information increase speculation, rumours, and conspiracy theories, which are all vulnerable to manipulation.;;no change;T0068 - Respond to Breaking News Event or Active Crisis;;;;;;;;;;;;;;;;;;
T0072;Segment Audiences;;TA13;Create audience segmentations by features of interest to the influence campaign, including political affiliation, geographic location, income, demographics, and psychographics.;;no change;T0072 - Segment Audiences;;;;;;;;;;;;;;;;;;
T0072.001;Geographic Segmentation;;TA13;An influence operation may target populations in a specific geographic location, such as a region, state, or city. An influence operation may use geographic segmentation to Create Localised Content (see: Establish Legitimacy).;;no change;Geographic Segmentation -;;;;;;;;;;;;;;;;;;
T0072.002;Demographic Segmentation;;TA13;An influence operation may target populations based on demographic segmentation, including age, gender, and income. Demographic segmentation may be useful for influence operations aiming to change state policies that affect a specific population sector. For example, an influence operation attempting to influence Medicare funding in the United States would likely target U.S. voters over 65 years of age.;;no change;Demographic Segmentation -;;;;;;;;;;;;;;;;;;
T0072.003;Economic Segmentation;;TA13;An influence operation may target populations based on their income bracket, wealth, or other financial or economic division.;;no change;Economic Segmentation -;;;;;;;;;;;;;;;;;;
