disarm_id;name;name_DE;tactic_id;summary;summary_DE;changes from v0.1;longname;;;;;;;;;;;;;;;;;;
T0093;Acquire/Recruit Network;;TA15;Operators acquire an existing network by paying, recruiting, or exerting control over the leaders of the existing network.;;new;T0093 - Acquire/Recruit Network;;;;;;;;;;;;;;;;;;
T0093.001;Fund Proxies;;TA15;An influence operation may fund proxies, or external entities that work for the operation. An operation may recruit/train users with existing sympathies towards the operation’s narratives and/or goals as proxies. Funding proxies serves various purposes including: - Diversifying operation locations to complicate attribution - Reducing the workload for direct operation assets;;no change;Fund Proxies -;;;;;;;;;;;;;;;;;;
T0093.002;Acquire Botnets;;TA15;A botnet is a group of bots that can function in coordination with each other.;;no change;Acquire Botnets -;;;;;;;;;;;;;;;;;;
T0094;Infiltrate Existing Networks;;TA15;Operators deceptively insert social assets into existing networks as group members in order to influence the members of the network and the wider information environment that the network impacts.;;new;T0094 - Infiltrate Existing Networks;;;;;;;;;;;;;;;;;;
T0094.001;Identify Susceptible Targets in Networks;;TA15;When seeking to infiltrate an existing network, an influence operation may identify individuals and groups that might be susceptible to being co-opted or influenced.;;no change;Identify Susceptible Targets in Networks -;;;;;;;;;;;;;;;;;;
T0094.002;Utilise Butterfly Attacks;;TA15;Butterfly attacks occur when operators pretend to be members of a certain social group, usually a group that struggles for representation. An influence operation may mimic a group to insert controversial statements into the discourse, encourage the spread of operation content, or promote harassment among group members. Unlike astroturfing, butterfly attacks aim to infiltrate and discredit existing grassroots movements, organisations, and media campaigns.;;no change;Utilise Butterfly Attacks -;;;;;;;;;;;;;;;;;;
T0095;Develop Owned Media Assets;;TA15;An owned media asset refers to an agency or organisation through which an influence operation may create, develop, and host content and narratives. Owned media assets include websites, blogs, social media pages, forums, and other platforms that facilitate the creation and organisation of content.;;new;T0095 - Develop Owned Media Assets;;;;;;;;;;;;;;;;;;
T0096;Leverage Content Farms;;TA15;Using the services of large-scale content providers for creating and amplifying campaign artefacts at scale.;;new;T0096 - Leverage Content Farms;;;;;;;;;;;;;;;;;;
T0096.001;Create Content Farms;;TA15;An influence operation may create an organisation for creating and amplifying campaign artefacts at scale.;;no change;Create Content Farms -;;;;;;;;;;;;;;;;;;
T0096.002;Outsource Content Creation to External Organisations;;TA15;An influence operation may outsource content creation to external companies to avoid attribution, increase the rate of content creation, or improve content quality, i.e., by employing an organisation that can create content in the target audience’s native language. Employed organisations may include marketing companies for tailored advertisements or external content farms for high volumes of targeted media.;;no change;Outsource Content Creation to External Organisations -;;;;;;;;;;;;;;;;;;
T0097;Present Persona;;TA16;This Technique contains different types of personas commonly taken on by threat actors during influence operations.<br><br>Analysts should use T0097’s sub-techniques to document the type of persona which an account is presenting. For example, an account which describes itself as being a journalist can be tagged with T0097.102: Journalist Persona.<br><br>Personas presented by individuals include:<br><br>T0097.100: Individual Persona<br>T0097.101: Local Persona<br>T0097.102: Journalist Persona<br>T0097.103: Activist Persona<br>T0097.104: Hacktivist Persona<br>T0097.105: Military Personnel Persona<br>T0097.106: Recruiter Persona<br>T0097.107: Researcher Persona<br>T0097.108: Expert Persona<br>T0097.109: Romantic Suitor Persona<br>T0097.110: Party Official Persona<br>T0097.111: Government Official Persona<br>T0097.112: Government Employee Persona<br><br>This Technique also houses institutional personas commonly taken on by threat actors:<br><br>T0097.200: Institutional Persona<br>T0097.201: Local Institution Persona<br>T0097.202: News Outlet Persona<br>T0097.203: Fact Checking Organisation Persona<br>T0097.204: Think Tank Persona<br>T0097.205: Business Persona<br>T0097.206: Government Institution Persona<br>T0097.207: NGO Persona<br>T0097.208: Social Cause Persona<br><br>By using a persona, a threat actor is adding the perceived legitimacy of the persona to their narratives and activities.;;new;T0097 - Present Persona;;;;;;;;;;;;;;;;;;
T0097.100;Individual Persona;;TA16;This sub-technique can be used to indicate that an entity is presenting itself as an individual. If the person is presenting themselves as having one of the personas listed below then these sub-techniques should be used instead, as they indicate both the type of persona they presented and that the entity presented itself as an individual:<br><br>T0097.101: Local Persona<br>T0097.102: Journalist Persona<br>T0097.103: Activist Persona<br>T0097.104: Hacktivist Persona<br>T0097.105: Military Personnel Persona<br>T0097.106: Recruiter Persona<br>T0097.107: Researcher Persona<br>T0097.108: Expert Persona<br>T0097.109: Romantic Suitor Persona<br>T0097.110: Party Official Persona<br>T0097.111: Government Official Persona<br>T0097.112: Government Employee Persona;;New in V1.5;;;;;;;;;;;;;;;;;;;
T0097.101;Local Persona;;TA16;A person with a local persona presents themselves as living in a particular geography or having local knowledge relevant to a narrative.<br><br>While presenting as a local is not an indication of inauthentic behaviour,  an influence operation may have its narratives amplified by people presenting as local to a target area. Threat actors can fabricate locals (T0143.002: Fabricated Persona, T0097.101: Local Persona) to add credibility to their narratives, or to misrepresent the real opinions of locals in the area.<br><br>People who are legitimate locals (T0143.001: Authentic Persona, T0097.101: Local Persona) can use their persona for malicious purposes, or be exploited by threat actors. For example, someone could take money for using their position as a local to provide legitimacy to a false narrative or be tricked into doing so without their knowledge.;;New in V1.5;;;;;;;;;;;;;;;;;;;
T0097.102;Journalist Persona;;TA16;A person with a journalist persona presents themselves as a reporter or journalist delivering news, conducting interviews, investigations etc.<br><br>While presenting as a journalist is not an indication of inauthentic behaviour, an influence operation may have its narratives amplified by people presenting as journalists. Threat actors can fabricate journalists to give the appearance of legitimacy, justifying the actor’s requests for interviews, etc (T0143.002: Fabricated Persona, T0097.102: Journalist Persona).<br><br>People who have legitimately developed a persona as a journalist (T0143.001: Authentic Persona, T0097.102: Journalist Persona) can use it for malicious purposes, or be exploited by threat actors. For example, someone could take money for using their position as a trusted journalist to provide legitimacy to a false narrative or be tricked into doing so without the journalist’s knowledge.;;New in V1.5;;;;;;;;;;;;;;;;;;;
T0097.103;Activist Persona;;TA16;"A person with an activist persona presents themselves as an activist; an individual who campaigns for a political cause, organises related events, etc.<br><br>While presenting as an activist is not an indication of inauthentic behaviour, an influence operation may have its narratives amplified by people presenting as activists. Threat actors can fabricate activists to give the appearance of popular support for an evolving grassroots movement (see T0143.002: Fabricated Persona, T0097.103: Activist Persona).<br><br>People who are legitimate activists can use this persona for malicious purposes, or be exploited by threat actors. For example, someone could take money for using their position as an activist to provide visibility to a false narrative or be tricked into doing so without their knowledge (T0143.001: Authentic Persona, T0097.103: Activist Persona).";;New in V1.5;;;;;;;;;;;;;;;;;;;
T0097.104;Hacktivist Persona;;TA16;"A person with a hacktivist persona presents themselves as an activist who conducts offensive cyber operations or builds technical infrastructure for political purposes, rather than the financial motivations commonly attributed to hackers; hacktivists are hacker activists who use their technical knowledge to take political action.<br><br>Hacktivists can build technical infrastructure to support other activists, including secure communication channels and surveillance and censorship circumvention. They can also conduct DDOS attacks and other offensive cyber operations, aiming to take down digital assets or gain access to proprietary information. An influence operation may use hacktivist personas to support their operational narratives and legitimise their operational activities.<br><br>Fabricated Hacktivists are sometimes referred to as “Faketivists”.";;New in V1.5;;;;;;;;;;;;;;;;;;;
T0097.105;Military Personnel Persona;;TA16;A person with a military personnel persona presents themselves as a serving member or veteran of a military organisation operating in an official capacity on behalf of a government.<br><br>While presenting as military personnel is not an indication of inauthentic behaviour,  an influence operation may have its narratives amplified by people presenting as military personnel. Threat actors can fabricate military personnel (T0143.002: Fabricated Persona, T0097.105: Military Personnel Persona) to pose as experts on military topics, or to discredit geopolitical adversaries by pretending to be one of their military personnel and spreading discontent.<br><br>People who have legitimately developed a military persona (T0143.001: Authentic Persona, T0097.105: Military Personnel Persona) can use it for malicious purposes, or be exploited by threat actors. For example, someone could take money for using their position as a member of the military to provide legitimacy to a false narrative or be tricked into doing so without their knowledge.;;New in V1.5;;;;;;;;;;;;;;;;;;;
T0097.106;Recruiter Persona;;TA16;A person with a recruiter persona presents themselves as a potential employer or provider of freelance work.<br><br>While presenting as a recruiter is not an indication of inauthentic behaviour, threat actors fabricate recruiters (T0143.002: Fabricated Persona, T0097.106: Recruiter Persona) to justify asking for personal information from their targets or to trick targets into working for the threat actors (without revealing who they are).;;New in V1.5;;;;;;;;;;;;;;;;;;;
T0097.107;Researcher Persona;;TA16;A person with a researcher persona presents themselves as conducting research (e.g. for academic institutions, or think tanks), or having previously conducted research.<br><br>While presenting as a researcher is not an indication of inauthentic behaviour,  an influence operation may have its narratives amplified by people presenting as researchers. Threat actors can fabricate researchers (T0143.002: Fabricated Persona, T0097.107: Researcher Persona) to add credibility to their narratives.<br><br>People who are legitimate researchers (T0143.001: Authentic Persona, T0097.107: Researcher Persona) can use their persona for malicious purposes, or be exploited by threat actors. For example, someone could take money for using their position as a Researcher to provide legitimacy to a false narrative or be tricked into doing so without their knowledge.;;New in V1.5;;;;;;;;;;;;;;;;;;;
T0097.108;Expert Persona;;TA16;A person with an expert persona presents themselves as having expertise or experience in a field. Commonly the persona’s expertise will be called upon to add credibility to a given narrative.<br><br>While presenting as an expert is not an indication of inauthentic behaviour,  an influence operation may have its narratives amplified by people presenting as experts. Threat actors can fabricate experts (T0143.002: Fabricated Persona, T0097.107: Researcher Persona) to add credibility to their narratives.<br><br>People who are legitimate experts (T0143.001: Authentic Persona, T0097.107: Researcher Persona) can make mistakes, use their persona for malicious purposes, or be exploited by threat actors. For example, someone could take money for using their position as an expert to provide legitimacy to a false narrative or be tricked into doing so without their knowledge.;;New in V1.5;;;;;;;;;;;;;;;;;;;
T0097.109;Romantic Suitor Persona;;TA16;A person with a romantic suitor persona presents themselves as seeking a romantic or physical connection with another person.<br><br>While presenting as seeking a romantic or physical connection is not an indication of inauthentic behaviour, threat actors can use dating apps, social media channels or dating websites to fabricate romantic suitors to lure targets they can blackmail, extract information from, deceive or trick into giving them money (T0143.002: Fabricated Persona, T0097.109: Romantic Suitor Persona).<br><br>Honeypotting in espionage and Big Butchering in scamming are commonly associated with romantic suitor personas.;;New in V1.5;;;;;;;;;;;;;;;;;;;
T0097.110;Party Official Persona;;TA16;A person who presents as an official member of a political party, such as leaders of political parties, candidates standing to represent constituents, and campaign staff.<br><br>Presenting as an official of a political party is not an indication of inauthentic behaviour, however threat actors may fabricate individuals who work in political parties to add credibility to their narratives (T0143.002: Fabricated Persona, T0097.110: Party Official Persona). They may also impersonate existing officials of political parties (T0143.003: Impersonated Persona, T0097.110: Party Official Persona).<br><br>Legitimate members of political parties could use their persona for malicious purposes, or be exploited by threat actors (T0143.001: Authentic Persona, T0097.110: Party Official Persona). For example, an electoral candidate could take money for using their position to provide legitimacy to a false narrative, or be tricked into doing so without their knowledge.;;New in V1.5;;;;;;;;;;;;;;;;;;;
T0097.111;Government Official Persona;;TA16;A person who presents as an active or previous government official has the government official persona. These are officials serving in government, such as heads of government departments, leaders of countries, and members of government selected to represent constituents.<br><br> Presenting as a government official is not an indication of inauthentic behaviour, however threat actors may fabricate individuals who work in government to add credibility to their narratives (T0143.002: Fabricated Persona, T0097.111: Government Official Persona). They may also impersonate existing members of government (T0143.003: Impersonated Persona, T0097.111: Government Official Persona).<br><br> Legitimate government officials could use their persona for malicious purposes, or be exploited by threat actors (T0143.001: Authentic Persona, T0097.111: Government Official Persona). For example, a government official could take money for using their position to provide legitimacy to a false narrative, or be tricked into doing so without their knowledge.;;New in V1.5;;;;;;;;;;;;;;;;;;;
T0097.112;Government Employee Persona;;TA16;A person who presents as an active or previous civil servant has the government employee persona. These are professionals hired to serve in government institutions and departments, not officials selected to represent constituents, or assigned official roles in government (such as heads of departments).<br><br> Presenting as a government employee is not an indication of inauthentic behaviour, however threat actors may fabricate individuals who work in government to add credibility to their narratives (T0143.002: Fabricated Persona, T0097.112: Government Employee Persona). They may also impersonate existing government employees (T0143.003: Impersonated Persona, T0097.112: Government Employee Persona).<br><br> Legitimate government employees could use their persona for malicious purposes, or be exploited by threat actors (T0143.001: Authentic Persona, T0097.112: Government Employee Persona). For example, a government employee could take money for using their position to provide legitimacy to a false narrative, or be tricked into doing so without their knowledge.;;New in V1.5;;;;;;;;;;;;;;;;;;;
T0097.200;Institutional Persona;;TA16;This Technique can be used to indicate that an entity is presenting itself as an institution. If the organisation is presenting itself as having one of the personas listed below then these Techniques should be used instead, as they indicate both that the entity presented itself as an institution, and the type of persona they presented:<br><br> T0097.201: Local Institution Persona<br> T0097.202: News Outlet Persona<br> T0097.203: Fact Checking Organisation Persona<br> T0097.204: Think Tank Persona<br> T0097.205: Business Persona<br> T0097.206: Government Institution Persona<br> T0097.207: NGO Persona<br> T0097.208: Social Cause Persona;;New in V1.5;;;;;;;;;;;;;;;;;;;
T0097.201;Local Institution Persona;;TA16;Institutions which present themselves as operating in a particular geography, or as having local knowledge relevant to a narrative, are presenting a local institution persona.<br><br> While presenting as a local institution is not an indication of inauthentic behaviour, threat actors may present themselves as such (T0143.002: Fabricated Persona, T0097.201: Local Institution Persona) to add credibility to their narratives, or misrepresent the real opinions of locals in the area.<br><br> Legitimate local institutions could use their persona for malicious purposes, or be exploited by threat actors (T0143.001: Authentic Persona, T0097.201: Local Institution Persona). For example, a local institution could take money for using their position to provide legitimacy to a false narrative, or be tricked into doing so without their knowledge.;;New in V1.5;;;;;;;;;;;;;;;;;;;
T0097.202;News Outlet Persona;;TA16;An institution with a news outlet persona presents itself as an organisation which delivers new information to its target audience.<br><br> While presenting as a news outlet is not an indication of inauthentic behaviour, an influence operation may have its narratives amplified by news organisations. Threat actors can fabricate news organisations (T0143.002: Fabricated Persona, T0097.202: News Outlet Persona), or they can impersonate existing news outlets (T0143.003: Impersonated Persona, T0097.202: News Outlet Persona).<br><br> Legitimate news organisations could use their persona for malicious purposes, or be exploited by threat actors (T0143.001: Authentic Persona, T0097.202: News Outlet Persona).;;New in V1.5;;;;;;;;;;;;;;;;;;;
T0097.203;Fact Checking Organisation Persona;;TA16;An institution with a fact checking organisation persona presents itself as an organisation which produces reports which assess the validity of others’ reporting / statements.<br><br> While presenting as a fact checking organisation is not an indication of inauthentic behaviour, an influence operation may have its narratives amplified by fact checking organisations. Threat actors can fabricate fact checking organisations (T0143.002: Fabricated Persona, T0097.202: News Outlet Persona), or they can impersonate existing fact checking outlets (T0143.003: Impersonated Persona, T0097.202: News Outlet Persona).<br><br> Legitimate fact checking organisations could use their persona for malicious purposes, or be exploited by threat actors (T0143.001: Authentic Persona, T0097.202: News Outlet Persona).;;New in V1.5;;;;;;;;;;;;;;;;;;;
T0097.204;Think Tank Persona;;TA16;"An institution with a think tank persona presents itself as a think tank; an organisation that aims to conduct original research and propose new policies or solutions, especially for social and scientific problems.<br><br> While presenting as a think tank is not an indication of inauthentic behaviour, think tank personas are commonly used by threat actors as a front for their operational activity (T0143.002: Fabricated Persona, T0097.204: Think Tank Persona). They may be created to give legitimacy to narratives and allow them to suggest politically beneficial solutions to societal issues.<br><br> Legitimate think tanks could have a political bias that they may not be transparent about, they could use their persona for malicious purposes, or they could be exploited by threat actors (T0143.001: Authentic Persona, T0097.204: Think Tank Persona). For example, a think tank could take money for using their position to provide legitimacy to a false narrative, or be tricked into doing so without their knowledge.";;New in V1.5;;;;;;;;;;;;;;;;;;;
T0097.205;Business Persona;;TA16;An institution with a business persona presents itself as a for-profit organisation which provides goods or services for a price.<br><br> While presenting as a business is not an indication of inauthentic behaviour, business personas may be used by threat actors as a front for their operational activity (T0143.002: Fabricated Persona, T0097.205: Business Persona).<br><br> Threat actors may also impersonate existing businesses (T0143.003: Impersonated Persona, T0097.205: Business Persona) to exploit their brand or cause reputational damage.<br><br> Legitimate businesses could use their persona for malicious purposes, or be exploited by threat actors (T0143.001: Authentic Persona, T0097.205: Business Persona). For example, a business could take money for using their position to provide legitimacy to a false narrative, or be tricked into doing so without their knowledge.;;New in V1.5;;;;;;;;;;;;;;;;;;;
T0097.206;Government Institution Persona;;TA16;Institutions which present themselves as governments, or government ministries, are presenting a government institution persona.<br><br> While presenting as a government institution is not an indication of inauthentic behaviour, threat actors may impersonate existing government institutions as part of their operation (T0143.003: Impersonated Persona, T0097.206: Government Institution Persona), to add legitimacy to their narratives, or discredit the government.<br><br> Legitimate government institutions could use their persona for malicious purposes, or be exploited by threat actors (T0143.001: Authentic Persona, T0097.206: Government Institution Persona). For example, a government institution could be used by elected officials to spread inauthentic narratives.;;New in V1.5;;;;;;;;;;;;;;;;;;;
T0097.207;NGO Persona;;TA16;Institutions which present themselves as an NGO (Non-Governmental Organisation), an organisation which provides services or advocates for public policy (while not being directly affiliated with any government), are presenting an NGO persona.<br><br> While presenting as an NGO is not an indication of inauthentic behaviour, NGO personas are commonly used by threat actors (such as intelligence services) as a front for their operational activity (T0143.002: Fabricated Persona, T0097.207: NGO Persona). They are created to give legitimacy to the influence operation and potentially infiltrate grassroots movements<br><br> Legitimate NGOs could use their persona for malicious purposes, or be exploited by threat actors (T0143.001: Authentic Persona, T0097.207: NGO Persona). For example, an NGO could take money for using their position to provide legitimacy to a false narrative, or be tricked into doing so without their knowledge.;;New in V1.5;;;;;;;;;;;;;;;;;;;
T0097.208;Social Cause Persona;;TA16;Online accounts which present themselves as focusing on a social cause are presenting the Social Cause Persona. Examples include accounts which post about current affairs, such as discrimination faced by minorities.<br><br> While presenting as an account invested in a social cause is not an indication of inauthentic behaviour, such personas have been used by threat actors to exploit peoples’ legitimate emotional investment regarding social causes that matter to them (T0143.002: Fabricated Persona, T0097.208: Social Cause Persona).<br><br> Legitimate accounts focused on a social cause could use their persona for malicious purposes, or be exploited by threat actors (T0143.001: Authentic Persona, T0097.208: Social Cause Persona). For example, the account holders could take money for using their position to provide legitimacy to a false narrative, or be tricked into doing so without their knowledge.;;New in V1.5;;;;;;;;;;;;;;;;;;;
T0098;Establish Inauthentic News Sites;;TA16;Modern computational propaganda makes use of a cadre of imposter news sites spreading globally. These sites, sometimes motivated by concerns other than propaganda--for instance, click-based revenue--often have some superficial markers of authenticity, such as naming and site-design. But many can be quickly exposed with reference to their owenership, reporting history and adverstising details.;;new;T0098 - Establish Inauthentic News Sites;;;;;;;;;;;;;;;;;;
T0098.001;Create Inauthentic News Sites;;TA16;Create Inauthentic News Sites;;no change;Create Inauthentic News Sites -;;;;;;;;;;;;;;;;;;
