disarm_id;name;name_DE;tactic_id;summary;summary_DE;changes from v0.1;longname;;;;;;;;;;;;;;;;;;
T0145.006;Attractive Person Account Imagery;;TA15;Attractive person used in account imagery.<br><br> An influence operation might flesh out its account by uploading account imagery (e.g. a profile picture), increasing its perceived authenticity.<br><br> Pictures of physically attractive people can benefit threat actors by increasing attention given to their posts.<br><br> People sometimes legitimately use images of attractive people as their profile picture, and threat actors can mimic this behaviour to avoid the risk of detection associated with stealing or AI-generating profile pictures (see T0145.001: Copy Account Imagery and T0145.002: AI-Generated Account Imagery).<br><br> This Technique is often used by Coordinated Inauthentic Behaviour accounts (CIBs). A collection of accounts displaying the same behaviour using similar account imagery can indicate the presence of CIB.;;New in V1.5;Attractive Person Account Imagery;;;;;;;;;;;;;;;;;;
T0145.007;Stock Image Account Imagery;;TA15;Stock images used in account imagery.<br><br> Stock image websites produce photos of people in various situations. Threat Actors can purchase or appropriate these images for use in their account imagery, increasing perceived legitimacy while avoiding the risk of detection associated with stealing or AI-generating profile pictures (see T0145.001: Copy Account Imagery and T0145.002: AI-Generated Account Imagery). <br><br> Stock images tend to include physically attractive people, and this can benefit threat actors by increasing attention given to their posts.<br><br> This Technique is often used by Coordinated Inauthentic Behaviour accounts (CIBs). A collection of accounts displaying the same behaviour using similar account imagery can indicate the presence of CIB.;;New in V1.5;Stock Image Account Imagery;;;;;;;;;;;;;;;;;;
T0146;Account Asset;;TA15;An Account is a user-specific profile that allows access to the features and services of an online platform, typically requiring a username and password for authentication.;;New in V1.6;;;;;;;;;;;;;;;;;;;
T0146.001;Free Account Asset;;TA15;Many online platforms allow users to create free accounts on their platform. A Free Account is an Account which does not require payment at account creation and is not subscribed to paid platform features.;;New in V1.6;;;;;;;;;;;;;;;;;;;
T0146.002;Paid Account Asset;;TA15;Some online platforms afford accounts extra features, or other benefits, if the user pays a fee. For example, as of September 2024, content posted by a Paid Account on X (previously Twitter) is prioritised in the platform’s algorithm.;;New in V1.6;;;;;;;;;;;;;;;;;;;
T0146.003;Verified Account Asset;;TA15;Some online platforms apply badges of verification to accounts which meet certain criteria.<br><br>On some platforms (such as dating apps) a verification badge signifies that the account has passed the platform’s identity verification checks. On some platforms (such as X (previously Twitter)) a verification badge signifies that an account has paid for the platform’s service.;;New in V1.6;;;;;;;;;;;;;;;;;;;
T0146.004;Administrator Account Asset;;TA15;"Some accounts will have special privileges / will be in control of the Digital Community Hosting Asset; for example, the Admin of a Facebook Page, a Moderator of a Subreddit, etc. etc.";;New in V1.6;;;;;;;;;;;;;;;;;;;
T0146.005;Lookalike Account ID;;TA15;Many platforms which host online communities require creation of a username (or another unique identifier) when an Account is created.<br><br>Sometimes people create usernames which are visually similar to other existing accounts’ usernames. While this is not necessarily an indicator of malicious behaviour, actors can create Lookalike Account IDs to support Impersonations or Parody.;;New in V1.6;;;;;;;;;;;;;;;;;;;
T0146.006;Open Access Platform;;TA15;Some online platforms allow users to take advantage of the platform’s features without creating an account. Examples include the Paste Platform Pastebin, and the Image Board Platforms 4chan and 8chan.;;New in V1.6;;;;;;;;;;;;;;;;;;;
T0146.007;Automated Account Asset;;TA15;An Automated Account is an account which is displaying automated behaviour, such as republishing or liking other accounts’ content, or publishing their own content.;;New in V1.6;;;;;;;;;;;;;;;;;;;
T0147;Software Asset;;TA15;A Software is a program developed to run on computers or devices that helps users achieve specific goals, such as improving productivity, automating tasks, or having fun.;;New in V1.6;;;;;;;;;;;;;;;;;;;
T0147.001;Game Asset;;TA15;A Game is Software which has been designed for interactive entertainment, where users take on challenges set by the game’s designers.<br><br>While Online Game Platforms allow people to play with each other, Games are designed for single player experiences.;;New in V1.6;;;;;;;;;;;;;;;;;;;
T0147.002;Game Mod Asset;;TA15;A Game Mod is a modification which can be applied to a Game or Multiplayer Online Game to add new content or functionality to the game.<br><br>Users can Modify Games to introduce new content to the game. Modified Games can be distributed on Software Delivery Platforms such as Steam or can be distributed within the Game or Multiplayer Online Game.;;New in V1.6;;;;;;;;;;;;;;;;;;;
T0147.003;Malware Asset;;TA15;Malware is Software which has been designed to cause harm or facilitate malicious behaviour on electronic devices.<br><br>DISARM recommends using the [MITRE ATT&CK Framework](https://attack.mitre.org/) to document malware types and their usage.;;New in V1.6;;;;;;;;;;;;;;;;;;;
T0147.004;Mobile App Asset;;TA15;A Mobile App is an application which has been designed to run on mobile operating systems, such as Android or iOS.<br><br>Mobile Apps can enable access to online platforms (e.g. Facebook’s mobile app) or can provide software which users can run offline on their device.;;New in V1.6;;;;;;;;;;;;;;;;;;;
T0148;Financial Instrument;;TA15;A Financial Instrument is a platform or software that facilitates the sending, receiving, and management of money, enabling financial transactions between users or organisations.<br><br>Threat actors can deploy financial instruments legitimately to manage their own finances or illegitimately to support fraud schemes.;;New in V1.6;;;;;;;;;;;;;;;;;;;
T0148.001;Online Banking Platform;;TA15;Online Banking Platforms are spaces provided by banks for their customers to manage their Bank Account online.<br><br>The Online Banking Platforms available differ by country. In the United Kingdom, examples of banking institutions which provide Online Banking Platforms include Lloyds, Barclays, and Monzo. In the United States, examples include Citibank, Chase, and Capital One.;;New in V1.6;;;;;;;;;;;;;;;;;;;
T0148.002;Bank Account Asset;;TA15;A Bank Account is a financial account that allows individuals or organisations to store, manage, and access their money, typically for saving, spending, or investment purposes.;;New in V1.6;;;;;;;;;;;;;;;;;;;
T0148.003;Payment Processing Platform;;TA15;Stripe, Paypal, and Apple Pay, Chargebee, Recurly and Zuora are examples of Payment Processing Platforms.<br><br>Payment Processing Platforms produce programs providing Payment Processing or Subscription Processing capabilities which actors can use to set up online storefronts, or to take donations.;;New in V1.6;;;;;;;;;;;;;;;;;;;
T0148.004;Payment Processing Capability;;TA15;A Payment Processing Capability is a feature of online platforms or software which enables the processing of one-off payments (e.g. an online checkout, or donation processing page).<br><br>Payment Processing Capabilities can enable platform users to purchase products or services or can facilitate donations to a given cause.;;New in V1.6;;;;;;;;;;;;;;;;;;;
T0148.005;Subscription Processing Capability;;TA15;A Subscription Processing Capability is a feature of online platforms or software which enables the processing of recurring payments. <br><br>Subscription Processing Capabilities are typically used to enable recurring payments in exchange for continued access to products or services.;;New in V1.6;;;;;;;;;;;;;;;;;;;
T0148.006;Crowdfunding Platform;;TA15;Kickstarter and GoFundMe are examples of Crowdfunding Platforms.<br><br>Crowdfunding Platforms enable users with Accounts to create projects for other platform users to finance, usually in exchange for access to fruits of the project.;;New in V1.6;;;;;;;;;;;;;;;;;;;
T0148.007;eCommerce Platform;;TA15;Amazon, eBay and Etsy are examples of eCommerce Platforms.<br><br>eCommerce Platforms enable users with Accounts to create online storefronts from which other platform users can purchase goods or services.;;New in V1.6;;;;;;;;;;;;;;;;;;;
T0148.008;Cryptocurrency Exchange Platform;;TA15;Coinbase and Kraken are examples of Cryptocurrency Exchange Platforms.<br><br>Cryptocurrency Exchange Platforms provide users a digital marketplace where they can buy, sell, and trade cryptocurrencies, such as Bitcoin or Ethereum. <br><br>Some Cryptocurrency Exchange Platforms allow users to create a Cryptocurrency Wallet.;;New in V1.6;;;;;;;;;;;;;;;;;;;
T0148.009;Cryptocurrency Wallet;;TA15;A Cryptocurrency Wallet is a digital tool that allows users to store, send, and receive cryptocurrencies. It manages private and public keys, enabling secure access to a user's crypto assets.<br><br>An influence operation might use cryptocurrency to conceal that they are conducting operational activities, building assets, or sponsoring aligning entities.;;New in V1.6;;;;;;;;;;;;;;;;;;;
T0149;Online Infrastructure;;TA15;Online Infrastructure consists of technical assets which enable online activity, such as domains, servers, and IP addresses.;;New in V1.6;;;;;;;;;;;;;;;;;;;
T0149.001;Domain Asset;;TA15;A Domain is a web address (such as “google[.]com”), used to navigate to Websites on the internet.<br><br>Domains differ from Websites in that Websites are considered to be developed web pages which host content, whereas Domains do not necessarily host public-facing web content. <br><br>A threat actor may register a new domain to bypass the old domain being blocked.;;New in V1.6;;;;;;;;;;;;;;;;;;;
T0149.002;Email Domain Asset;;TA15;An Email Domain is a Domain (such as “meta[.]com”) which has the ability to send emails (e.g. from an @meta[.]com address). <br><br>Any Domain which has an MX (Mail Exchange) record and configured SMTP (Simple Mail Transfer Protocol) settings can send and receive emails, and is therefore an Email Domain. ;;New in V1.6;;;;;;;;;;;;;;;;;;;
T0149.003;Lookalike Domain;;TA15;A Lookalike Domain is a Domain which is visually similar to another Domain, with the potential for web users to mistake one domain for the other.<br><br>Threat actors who want to impersonate organisations’ websites have been observed using a variety of domain impersonation methods. For example, actors wanting to create a domain impersonating netflix.com may use methods such as typosquatting (e.g. n3tflix.com), combosquatting (e.g. netflix-billing.com), or TLD swapping (e.g. netflix.top).;;New in V1.6;;;;;;;;;;;;;;;;;;;
T0149.004;Redirecting Domain Asset;;TA15;A Redirecting Domain is a Domain which has been configured to redirect users to another Domain when visited.;;New in V1.6;;;;;;;;;;;;;;;;;;;
T0149.005;Server Asset;;TA15;A Server is a computer which provides resources, services, or data to other computers over a network. There are different types of servers, such as web servers (which serve web pages and applications to users), database servers (which manage and provide access to databases), and file servers (which store and share files across a network).;;New in V1.6;;;;;;;;;;;;;;;;;;;
T0149.006;IP Address Asset;;TA15;An IP Address is a unique numerical label assigned to each device connected to a computer network that uses the Internet Protocol for communication. IP addresses are commonly a part of any online infrastructure.<br><br>IP addresses can be in IPV4 dotted decimal (x.x.x.x) or IPV6 colon-separated hexadecimal (y:y:y:y:y:y:y:y) formats. ;;New in V1.6;;;;;;;;;;;;;;;;;;;
T0149.007;VPN Asset;;TA15;A VPN (Virtual Private Network) is a service which creates secure, encrypted connections over the internet, allowing users to transmit data safely and access network resources remotely. It masks IP Addresses, enhancing privacy and security by preventing unauthorised access and tracking. VPNs are commonly used for protecting sensitive information, bypassing geographic restrictions, and maintaining online anonymity.<br><br>VPNs can also allow a threat actor to pose as if they are located in one country while in reality being based in another. By doing so, they can try to either mis-attribute their activities to another actor or better hide their own identity.;;New in V1.6;;;;;;;;;;;;;;;;;;;
T0149.008;Proxy IP Address Asset;;TA15;A Proxy IP Address allows a threat actor to mask their real IP Address by putting a layer between them and the online content they’re connecting with. <br><br>Proxy IP Addresses can hide the connection between the threat actor and their online infrastructure.;;New in V1.6;;;;;;;;;;;;;;;;;;;
T0149.009;Internet Connected Physical Asset;;TA15;An Internet Connected Physical Asset (sometimes referred to as IoT (Internet of Things)) is a physical asset which has internet connectivity to support online features, such as digital signage, wireless printers, and smart TVs.;;New in V1.6;;;;;;;;;;;;;;;;;;;
T0150;Asset Origin;;TA15;Asset Origin contains a list of ways that an actor can obtain an asset. For example, they can create new accounts on online platforms, or they can compromise existing accounts or websites.;;New in V1.6;;;;;;;;;;;;;;;;;;;
T0150.001;Newly Created Asset;;TA15;A Newly Created Asset is an asset which has been created and used for the first time in a documented potential incident.<br><br>For example, analysts which can identify a recent creation date of Accounts participating in the spread of a new narrative can assert these are Newly Created Assets.<br><br>Analysts should use Dormant if the asset was created and laid dormant for an extended period of time before activity.;;New in V1.6;;;;;;;;;;;;;;;;;;;
T0150.002;Dormant Asset;;TA15;A Dormant Asset is an asset which was inactive for an extended period before being used in a documented potential incident.;;New in V1.6;;;;;;;;;;;;;;;;;;;
T0150.003;Pre-Existing Asset;;TA15;"Pre-Existing Assets are assets which existed before the observed incident which have not been Repurposed; i.e. they are still being used for their original purpose. <br><br>An example could be an Account which presented itself with a Journalist Persona prior to and during the observed potential incident.";;New in V1.6;;;;;;;;;;;;;;;;;;;
T0150.004;Repurposed Asset;;TA15;Repurposed Assets are assets which have been identified as being used previously, but are now being used for different purposes, or have new Presented Personas.<br><br>Actors have been documented compromising assets, and then repurposing them to present Inauthentic Personas as part of their operations.;;New in V1.6;;;;;;;;;;;;;;;;;;;
T0150.005;Compromised Asset;;TA15;A Compromised Asset is an asset which was originally created or belonged to another person or organisation, but which an actor has gained access to without their consent.<br><br>See also MITRE ATT&CK T1708: Valid Accounts.;;New in V1.6;;;;;;;;;;;;;;;;;;;
T0150.006;Purchased Asset;;TA15;A Purchased Asset is an asset which actors paid for the ownership of. <br><br>For example, threat actors have been observed selling compromised social media accounts on dark web marketplaces, which can be used to disguise operation activity.;;New in V1.6;;;;;;;;;;;;;;;;;;;
T0150.007;Rented Asset;;TA15;A Rented Asset is an asset which actors are temporarily renting or subscribing to. <br><br>For example, threat actors have been observed renting temporary access to legitimate accounts on online platforms in order to disguise operation activity.;;New in V1.6;;;;;;;;;;;;;;;;;;;
T0150.008;Bulk Created Asset;;TA15;A Bulk Created Asset is an asset which was created alongside many other instances of the same asset.<br><br>Actors have been observed bulk creating Accounts on Social Media Platforms such as Facebook. Indicators of bulk asset creation include its creation date, assets’ naming conventions, their configuration (e.g. templated personas, visually similar profile pictures), or their activity (e.g. post timings, narratives posted).;;;;;;;;;;;;;;;;;;;;;
T0151;Digital Community Hosting Asset;;TA07;"A Digital Community Hosting Asset is an online asset which can be used by actors to provide spaces for users to interact with each other.<br><br>Sub-techniques categorised under Digital Community Hosting Assets can include Content Hosting and Content Delivery capabilities; however, their nominal primary purpose is to provide a space for community interaction.";;New in V1.6;;;;;;;;;;;;;;;;;;;
T0151.001;Social Media Platform;;TA07;Examples of popular Social Media Platforms include Facebook, Instagram, and VK.<br><br>Social Media Platforms allow users to create Accounts, which they can configure to present themselves to other platform users. This typically involves Establishing Account Imagery and Presenting a Persona.<br><br>Social Media Platforms typically allow the creation of Online Community Groups and Online Community Pages.<br><br>Accounts on Social Media Platforms are typically presented with a feed of content posted to the platform. The content that populates this feed can be aggregated by the platform’s proprietary Content Recommendation Algorithm, or users can “friend” or “follow” other accounts to add their posts to their feed.<br><br>Many Social Media Platforms also allow users to send direct messages to other users on the platform. ;;New in V1.6;;;;;;;;;;;;;;;;;;;
T0151.002;Online Community Group;;TA07;"Some online platforms allow people with Accounts to create Online Community Groups. Groups are usually created around a specific topic or locality, and allow users to post content to the group, and interact with other users’ posted content. <br><br>For example, Meta’s Social Media Platform Facebook allows users to create a “Facebook group”. This feature is not exclusive to Social Media Platforms; the Microblogging Platform X (prev. Twitter) allows users to create “X Communities”, groups based on particular topics which users can join and post to; the Software Delivery Platform Steam allows users to create Steam Community Groups.<br><br>Online Community Groups can be open or gated (for example, groups can require admin approval before users can join).";;New in V1.6;;;;;;;;;;;;;;;;;;;
T0151.003;Online Community Page;;TA07;A Facebook Page is an example of an Online Community Page.<br><br>Online Community Pages allow Administrator Accounts to post content to the page, which other users can interact with. Pages can be followed or liked by other users - but these users can’t initiate new posts to the page.;;New in V1.6;;;;;;;;;;;;;;;;;;;
T0151.004;Chat Platform;;TA07;"Examples of popular Chat Platforms include WhatsApp, WeChat, Telegram, and Signal; Slack, Mattermost, and Discord; Zoom, GoTo Meeting, and WebEx.<br><br>Chat Platforms allow users to engage in text, audio, or video chats with other platform users.<br><br>Different Chat Platforms afford users different capabilities. Examples include Direct Messaging, Chat Rooms, Chat Broadcast Channels, and Chat Community Servers.<br><br>Some Chat Platforms enable encrypted communication between platform users.";;New in V1.6;;;;;;;;;;;;;;;;;;;
T0151.005;Chat Community Server;;TA07;Chat Platforms such as Discord, Slack, and Microsoft Teams allow users to create their own Chat Community Servers, which they can invite other platform users to join.<br><br>Chat Community Servers are online communities made up of Chat Rooms (or “Channels”) in which users can discuss the given group’s topic. Groups can either be public (shown in the server’s browsable list of channels, available for any member to view and join) or Gated (users must be added to the chat group by existing members to participate).<br><br>Some Chat Community Servers allow users to create Chat Broadcast Groups, in which only specific members (e.g. server administrators) of the chat are able to post new content to the group.;;New in V1.6;;;;;;;;;;;;;;;;;;;
T0151.006;Chat Room;;TA07;"Many platforms which enable community interaction allow users to create Chat Rooms; a room in which members of the group can talk to each other via text, audio, or video.<br><br>Most Chat Rooms are Gated; users must be added to the chat group before they can post to the chat group, or view its content. For example, on WhatsApp a user can create a Chat Room containing other WhatsApp users whose contact information they have. At this point the user who created the Chat Room has an Administrator Account; they are uniquely able to add other users to the Chat Room.<br><br>However, Chat Rooms made on Chat Community Servers such as Discord can be Gated or open. If left open, anyone on the server can view the Chat Room (“channel”), read its contents, and choose to join it.<br><br>Examples of Platforms which allow creation of Chat Rooms include:<br>Instagram, Facebook, X (prev. Twitter) (Group Direct Messaging)<br>Whatsapp, Telegram, WeChat, Signal (Group Chats)<br>Discord, Slack, Mattermost, Microsoft Teams (Channels)";;New in V1.6;;;;;;;;;;;;;;;;;;;
T0151.007;Chat Broadcast Group;;TA07;A Chat Broadcast Group is a type of Chat Group in which only specific members can send content to the channel (typically administrators, or approved group members). Members of the channel may be able to react to content, or comment on it, but can’t directly push new content to the channel.<br><br>Examples include:<br>WhatsApp, Telegram, Discord: Chat Groups in which only admins are able to post new content.<br>X (prev. Twitter): Spaces (an audio discussion hosting feature) in which admins control who can speak at a given moment.;;New in V1.6;;;;;;;;;;;;;;;;;;;
T0151.008;Microblogging Platform;;TA07;Examples of Microblogging Platforms include TikTok, Threads, Bluesky, Mastodon, QQ, Tumblr, and X (formerly Twitter).<br><br>Microblogging Platforms allow users to create Accounts, which they can configure to present themselves to other platform users. This typically involves Establishing Account Imagery and Presenting a Persona. <br><br>Accounts on Microblogging Platforms are able to post short-form text content alongside media.<br><br>Content posted to the platforms is aggregated into different feeds and presented to the user. Typical feeds include content posted by other Accounts which the user follows, and content promoted by the platform’s proprietary Content Recommendation Algorithm. Users can also search or use hashtags to discover new content.<br><br>Mastodon is an open-source decentralised software which allows anyone to create their own Microblogging Platform that can communicate with other platforms within the “fediverse” (similar to how different email platforms can send emails to each other). Meta’s Threads is a Microblogging Platform which can interact with the fediverse.;;New in V1.6;;;;;;;;;;;;;;;;;;;
T0151.009;Legacy Online Forum Platform;;TA07;Examples of Legacy Online Forum Platforms include Something Awful (SA Forums), Ars Technica forums, and NeoGAF, and the forums available on the Mumsnet and War Thunder websites.<br><br>Legacy Online Forum Platforms are a type of message board (using software such as vBulletin or phpBB) popular in the early 2000s for online communities. They are often used to provide spaces for a community to exist around a given website or topic. <br><br>Legacy Online Forum Platforms allow users to create Accounts to join in discussion threads posted to any number of Forums and Sub-Forums on the platform. Forums and Sub-Forums can be Gated, allowing access to approved users only. They can vary in size. Some are larger platforms that host a wider set of topics and communities while others are smaller in scope and size. ;;New in V1.6;;;;;;;;;;;;;;;;;;;
T0151.010;Community Forum Platform;;TA07;Reddit, Lemmy and Tildes are examples of Community Forum Platforms.<br><br>Community Forum Platforms are exemplified by users’ ability to create their own sub-communities (Community Sub-Forums) which other platform users can join. <br><br>Platform users can view aggregated content from all Community Sub-Forums they subscribe to, or they can view all content from a particular Community Sub-Forum.;;New in V1.6;;;;;;;;;;;;;;;;;;;
T0151.011;Community Sub-Forum;;TA07;Community Forum Platforms are made up of many Community Sub-Forums. Sub-Forums provide spaces for platform users to create a community based around any topic. <br><br>For example, Reddit (a popular Community Forum Platform) has over 138,000 “subreddits” (Community Sub-Forums), including 1082 unique cat-based communities.<br><br>Typically, Sub-Forums allow users post text, image, or video to them, and other platform users can up/downvote, or comment on it. Sub-forums may have their own extra rules alongside the platform’s global rules, enforced by community moderators. <br><br>While most Sub-Forums are made by users with Accounts on the Community Forum Platform, Sub-Forums can also be created by the platform itself.;;New in V1.6;;;;;;;;;;;;;;;;;;;
